The Unity Council,Legal Services,Provides assistance applying for unemployment benefits.,Unemployment benefits,,(510) 535-6101,careercenter@unitycouncil.org,,Specific County,Alameda (concentrated in Oakland),,,0,0,https://docs.google.com/forms/d/e/1FAIpQLSfC3XWuWVfIstbOMQR2zpYZxBNigBzC7Sk4HS8G82gU-Hi__A/viewform,https://docs.google.com/forms/d/e/1FAIpQLScteWS2NddfbtV0LidJ2wyq7oaYv-9cazjcWOLR8DoBsDyBGA/viewform,"Housing & Homelessness, Employment & Worker Protections, Immigration"
Oakland Private Industry Council,Hotline,Unemployment benefits Assistance Hotline,Unemployment benefits,,(510) 675-7909,info@oaklandpic.org,,Specific County,Alameda (Oakland),"68 Grand Ave., Oakland, CA 94610",,0,0,https://www.oaklandpic.org/coronavirus-resources,,Employment & Worker Protections
Katharine & George Alexander Community Law Center,Legal Services,Provides free legal services and weekly advice clinics for low-income individuals who have experienced unfair and illegal treatment at their place of employment. Workers should call to make an appointment for one of the weekly clinics.,Unemployment benefits; wrongful termination; unpaid wages; discrimination; paid family leave; paid sick leave,Low-income,(408) 288-7030,,,Specific County,Santa Clara County,"1030 The Alameda
San Jose, CA 95126",,0,0,https://law.scu.edu/kgaclc/workers-rights/,https://law.scu.edu/kgaclc/advice-clinics-spanish/,"Employment & Worker Protections, Immigration"
County of Santa Clara Office of Labor Standards Enforcement (OLSE) Advice Line,Hotline,Provides workers with assistance in how to receive a portion of their wages due to COVID-19 impacting their work,Unemployment benefits; disability benefits; paid family leave,,1(866) 870-7725,,,Specific County,Santa Clara,,,0,0,https://www.sccgov.org/sites/olse/Pages/home.aspx,,Employment & Worker Protections
Santa Clara County COVID-19 Assistance Navigation (CAN),Hotline,"Answers questions and guides callers through the process of applying for unemployment insurance, disability, paid family leave, and other safety net programs",Unemployment benefits; disability benefits; paid family leave,,(408) 809-2124,,,Specific County,Santa Clara,,,0,0,https://wpusa.org/programs/santa-clara-county-can-covid-19-assistance-navigation/,,Employment & Worker Protections
CAIR-CA,Hotline,"Will answer your questions regarding unemployment as a result of COVID-19, help assess your eligibility, and guide you to the resources that will ensure you stay protected and informed. Also handles workplace discrimination claims.",Unemployment benefits; discrimination,,408986987,,,Nationwide,,,,0,0,https://ca.cair.com/sfba/updates/expanding-cairs-legal-services-to-respond-to-covid-19/,,Employment & Worker Protections
CA Employment Development Department (EDD),General Information,How to file a claim if you are unable to work because you are caring for an ill or quarantined family member with COVID-19.,Paid family leave,,"",,,Statewide,,,,0,0,https://www.edd.ca.gov/Disability/How_to_File_a_PFL_Claim_in_SDI_Online.htm,https://www.edd.ca.gov/Disability/How_to_File_a_PFL_Claim_in_SDI_Online_Espanol.htm,Employment & Worker Protections
CA Employment Development Department (EDD),General Information,How to file a claim if you are unable to work due to having or being exposed to COVID-19.,Disability benefits; paid sick leave,,"",,,Statewide,,,,0,0,https://www.edd.ca.gov/Disability/How_to_File_a_DI_Claim_in_SDI_Online.htm,https://youtu.be/SVqLEyQY8fg,Employment & Worker Protections
CA Employment Development Department (EDD),General Information,How to file a claim if your employer has reduced hours or shut down operations due to COVID-19. Provides partial wage replacement. Parents taking care of kids whose schools have closed may be eligible for benefits.,Unemployment benefits,,"",,,Statewide,,,,0,0,https://www.edd.ca.gov/Unemployment/Filing_a_Claim.htm,https://www.edd.ca.gov/Unemployment/Filing_a_Claim_Espanol.htm,Employment & Worker Protections
San Francisco Office of Labor Standards Enforement (OLSE),Hotline,Answers questions regarding workers' rights under the San Francisco Paid Sick Leave Ordinance,Paid sick leave,,(415) 554-6271,psl@sfgov.org,,Specific County,San Francisco,,,0,0,https://sfgov.org/olse/paid-sick-leave-ordinance-pslo,,Employment & Worker Protections
California Labor & Workforce Development Agency,General Information,Summary Chart of Potential Benefits for Workers Impacted by COVID-19,,,"",,,Nationwide,,,,0,0,https://www.labor.ca.gov/coronavirus2019#chart,,Employment & Worker Protections
San Francisco OEWD Worker Information Line,Hotline,Information line for employees impacted by COVID-19,,,(415) 701-4817,workforce.connection@sfgov.org,,Specific County,San Francisco,,,0,0,https://oewd.org/employees-impacted-covid-19#Unemployment%20Benefits,,Employment & Worker Protections
Occupational Safety and Health Administration (OSHA),Hotline,File a health or safety complaint for workplace conditions,Worker protections,,8003216742(415) 625-2547,,,Nationwide,,,,0,0,https://www.osha.gov/workers/file_complaint.html,,Employment & Worker Protections
